{
  "gateResultId": "GTR-HG-30-1785943485578",
  "runId": "SAMPLE-AV-INQUIRY",
  "gateId": "HG-30",
  "gateVersion": "1.0.0",
  "decision": "PASS",
  "qualityScore": 100,
  "hardFailureCount": 0,
  "requiredFailureCount": 0,
  "evaluatedAt": "2026-08-05T15:24:45.576Z",
  "summary": "AA/DA/SEC approved: ADR-001, AV_ASSET_VALUATION ownership AV/AssetValuation, security inquiry-only OK",
  "ruleResults": [],
  "approvalIds": [],
  "exceptionIds": []
}
